{
  "schema_version": "1.0.0",
  "assessment_id": "a89351e7-4b5b-407c-a9df-0be7435e6a6a",
  "created_at_utc": "2026-08-24T01:14:12.663662+00:00",
  "frame_id": "pallet_detect_v1_008b44ae079f30b0d8e7.jpg",
  "track_id": "single-frame-pallet-001",
  "pose": {
    "available": false,
    "x_m": null,
    "y_m": null,
    "theta_deg": null,
    "visible_face": null,
    "covariance_xy_m2": null,
    "theta_std_deg": null,
    "confidence": 0.0,
    "reprojection_rmse_px": null,
    "reasons": [
      "metric_pose_unavailable_no_keypoint_checkpoint",
      "assignment_camera_calibration_not_supplied",
      "single_view_load_evidence_incomplete"
    ]
  },
  "checks": [
    {
      "check_id": "SOP-PAL-03-1",
      "name": "No box overhang above 3 cm",
      "scope": "PARTIAL",
      "verdict": "MANUAL_REVIEW",
      "confidence": 0.0,
      "reason": "required metric evidence is missing",
      "evidence": {}
    },
    {
      "check_id": "SOP-PAL-03-2",
      "name": "Load height at most 1.8 m",
      "scope": "PARTIAL",
      "verdict": "MANUAL_REVIEW",
      "confidence": 0.0,
      "reason": "required metric evidence is missing",
      "evidence": {}
    },
    {
      "check_id": "SOP-PAL-03-3",
      "name": "Columns aligned within 15 degrees",
      "scope": "PARTIAL",
      "verdict": "MANUAL_REVIEW",
      "confidence": 0.0,
      "reason": "required metric evidence is missing",
      "evidence": {}
    },
    {
      "check_id": "SOP-PAL-03-4",
      "name": "No box-size inversion",
      "scope": "PARTIAL",
      "verdict": "MANUAL_REVIEW",
      "confidence": 0.0,
      "reason": "required probability evidence is missing",
      "evidence": {}
    },
    {
      "check_id": "SOP-PAL-03-5",
      "name": "Load stretch-wrapped",
      "scope": "PARTIAL",
      "verdict": "MANUAL_REVIEW",
      "confidence": 0.0,
      "reason": "stretch-wrap probability is missing",
      "evidence": {}
    },
    {
      "check_id": "SOP-PAL-03-6",
      "name": "No visibly damaged or crushed box",
      "scope": "PARTIAL",
      "verdict": "MANUAL_REVIEW",
      "confidence": 0.0,
      "reason": "required probability evidence is missing",
      "evidence": {}
    },
    {
      "check_id": "SOP-PAL-03-7",
      "name": "Load centroid within 10 cm",
      "scope": "PARTIAL",
      "verdict": "MANUAL_REVIEW",
      "confidence": 0.0,
      "reason": "required metric evidence is missing",
      "evidence": {}
    },
    {
      "check_id": "SOP-PAL-03-8",
      "name": "No visible pallet damage",
      "scope": "PARTIAL",
      "verdict": "MANUAL_REVIEW",
      "confidence": 0.0,
      "reason": "required probability evidence is missing",
      "evidence": {}
    }
  ],
  "overall_verdict": "MANUAL_REVIEW",
  "overall_confidence": 0.0,
  "reasoning": [
    "placement pose is not reliable",
    "metric_pose_unavailable_no_keypoint_checkpoint",
    "assignment_camera_calibration_not_supplied",
    "single_view_load_evidence_incomplete"
  ],
  "model_versions": {
    "pallet_detector": "detect-real-v1@36273b60fb817a0d",
    "structural_segmenter": "segment-real-v1@79aaaa6c147ef566",
    "carton_segmenter": "carton-seg-scd-v1@5bffd9bdcd58f588",
    "pose": "UNAVAILABLE:no-trained-keypoint-checkpoint",
    "damage": "UNAVAILABLE:no-reviewed-damage-labels",
    "wrap": "UNAVAILABLE:no-reviewed-wrap-labels"
  },
  "calibration_id": null
}
